job_title,job_link,description,company_name
Software Engineer Intern,https://www.indeed.com/rc/clk?jk=83930132450a2492&fccid=936367796261bd6e&vjs=3,"Job details
No matching job preferences
Job Type
Internship
Manufacturing, Supply Chain and Operations Automation at the Hillsboro campus in Oregon is seeking a Full-Stack Software Application Development Engineering Intern to develop front-end applications supporting a variety of front-end analytic applications.
Please note this internship will be for almost a full year from July '23 to May of '24.
Some responsibilities may include but not limited to:
Designs, develops, tests, and debugs software applications used by end-users or integrated with other applications by MSOA partners.
Development may span the full application stack including both frontend and backend application development.
Scripting - data extract, data summarization.
Data validation

Qualifications

Qualifications
Job Qualifications:
You must possess the below minimum qualifications to be initially considered for this position. Qualifications listed as preferred or additional will be considered a plus factor for applicants.
Minimum Qualifications:
Candidate must be actively pursuing a Bachelor's degree in Computer Science Computer Engineering or a related field of study.
6+ months of experience in the following fields:
Working knowledge of basic computer science data structures and algorithms.
Developing rich applications with Angular JS, HTML, CSS and Typescript experience.
Developing front-end software, with experience in front-end MVC/MVM frameworks.
Developing database tables to support front-end applications.
Preferred Qualifications:
UI Test Automation frameworks.
Skills around developing and integrating with RESTful APIs in C# or Django/Python.
Experience in trouble shooting and root cause analysis for performance issues.
Experience with source control tools GIT and ability to review code.
Experience in leveraging opensource packages.
Experience with semiconductor manufacturing
Demonstrated experience and ability to deliver results on multiple projects in a fast-paced agile environment following SDLC practices

Inside this Business Group

As the world's largest chip manufacturer, Intel strives to make every facet of semiconductor manufacturing state-of-the-art - from semiconductor process development and manufacturing, through yield improvement to packaging, final test and optimization, and world class Supply Chain and facilities support. Employees in the Technology Development and Manufacturing Group are part of a worldwide network of design, development, manufacturing, and assembly/test facilities, all focused on utilizing the power of Moore’s Law to bring smart, connected devices to every person on Earth.
Covid Statement

Intel strongly encourages employees to be vaccinated against COVID-19. Intel aligns to federal, state, and local laws and as a contractor to the U.S. Government is subject to government mandates that may be issued. Intel policies for COVID-19 including guidance about testing and vaccination are subject to change over time.
Posting Statement

All qualified applicants will receive consideration for employment without regard to race, color, religion, religious creed, sex, national origin, ancestry, age, physical or mental disability, medical condition, genetic information, military and veteran status, marital status, pregnancy, gender, gender expression, gender identity, sexual orientation, or any other characteristic protected by local law, regulation, or ordinance.
Benefits

We offer a total compensation package that ranks among the best in the industry. It consists of competitive pay, stock, bonuses, as well as, benefit programs which include health, retirement, and vacation. Find more information about all of our Amazing Benefits here: https://www.intel.com/content/www/us/en/jobs/benefits.html
Working Model

This role will be eligible for our hybrid work model which allows employees to split their time between working on-site at their assigned Intel site and off-site. In certain circumstances the work model may change to accommodate business needs.",Screenovate
Care Management Data Analysis Intern,https://www.indeed.com/rc/clk?jk=f35ee583237672d6&fccid=372688670c2370a2&vjs=3,"Job details
No matching job preferences
Job Type
Temporary
Shift and Schedule
No weekends
Introduction
Do you want to join an organization that invests in you? At HCA Healthcare, you come first. HCA Healthcare has committed up to $300 million in programs to support our incredible team members over the course of three years.
Benefits
HCA Healthcare, offers a total rewards package that supports the health, life, career and retirement of our colleagues. The available plans and programs include:
Comprehensive medical coverage that covers many common services at no cost or for a low copay. Plans include prescription drug and behavioral health coverage as well as free telemedicine services and free AirMed medical transportation.
Additional options for dental and vision benefits, life and disability coverage, flexible spending accounts, supplemental health protection plans (accident, critical illness, hospital indemnity), auto and home insurance, identity theft protection, legal counseling, long-term care coverage, moving assistance, pet insurance and more.
Free counseling services and resources for emotional, physical and financial wellbeing
401(k) Plan with a 100% match on 3% to 9% of pay (based on years of service)
Employee Stock Purchase Plan with 10% off HCA Healthcare stock
Family support through fertility and family building benefits with Progyny and adoption assistance.
Referral services for child, elder and pet care, home and auto repair, event planning and more
Consumer discounts through Abenity and Consumer Discounts
Retirement readiness, rollover assistance services and preferred banking partnerships
Education assistance (tuition, student loan, certification support, dependent scholarships)
Colleague recognition program
Time Away From Work Program (paid time off, paid family leave, long- and short-term disability coverage and leaves of absence)
Employee Health Assistance Fund that offers free employee-only coverage to full-time and part-time colleagues based on income.
Learn more about Employee Benefits
Note: Eligibility for benefits may vary by location.

You contribute to our success. Every role has an impact on our patients’ lives and you have the opportunity to make a difference. We are looking for a dedicated Care Management Data Analysis Intern like you to be a part of our team.
Job Summary and Qualifications
The Care Management Data Analysis Intern will be focused on gaining experiences within HCA’s Care Management product suite including its functionality and utilization, collaborating with project teams and business partners to meet ITG project objectives.
The intern candidate will be engaged in design, building, implementation and support of ITG Care Management Enterprise Reporting solutions. This position will collaborate with other data analysts, engineers, developers and business/product analysts to ensure accurate data and visual representations are delivered on time following business owner specifications and HCA ITG development standards.
This position will require a candidate who is willing to learn how to analyze business requirements, perform design tasks, construct, test and implement data solutions with limited supervision. The candidate will need to be able to work across a mixed team environment and learn from other colleague strengths and talents. This position requires a highly motivated self-starter, an enthusiastic learner committed to delivering high quality solutions within scheduled timelines.

Duties Include But Are Not Limited To:
Collaborates with team members to successfully execute reporting initiatives
Capable of using Agile practices and principles
Participates in large-scale data curation and report development
Develops and identifies potential operational changes to streamline operations and enhance service delivery
Collaborates with business analysts, project lead, management and customers on requirements
Designs fit-for-purpose data products
Understands the software development life cycle
Ability to multi task, given various task assignments, assisting management in prioritization of tasks
Take ownership of responsibilities, working individually or with teams to accomplish goals
Creation of prototypes and proof of concepts for reporting considerations
Perform other duties as assigned
Practice and adhere to the “Code of Conduct” philosophy and “Mission and Value Statement”
Knowledge, Skills, and Abilities
Solid understanding of SQL and query development
Proficient in MS PowerBI data visualizations
Professional demeanor and positive attitude; customer service orientation
Excellent communication and inter-personal skills
Ability to learn, understand, and apply new technologies, methods, and processes
Working knowledge of scrum and agile project delivery methodologies
Analyzes objectives, solves problems, and develops solutions Keeps technically current with changes across technical environment
What qualifications you will need:
College student, preferably with at least one year left before graduation.
A year or less related experience
Ability to build trust and act with authenticity to cultivate a culture of integrity, inclusion, and mutual respect
Ability to make timely, informed decisions that are in the best interest of our patients, employees, providers, community and HCA
A background working with a fast paced, results oriented environment

HCA Healthcare has been recognized as one of the World’s Most Ethical Companies® by the Ethisphere Institute more than ten times. In recent years, HCA Healthcare spent an estimated $3.7 billion in cost for the delivery of charitable care, uninsured discounts, and other uncompensated expenses.

""Good people beget good people.""- Dr. Thomas Frist, Sr.
HCA Healthcare Co-Founder
We are a family 270,000 dedicated professionals! Our Talent Acquisition team is reviewing applications for our Care Management Data Analysis Intern opening. Qualified candidates will be contacted for interviews. Submit your resume today to join our community of caring!
We are an equal opportunity employer and value diversity at our company. We do not discriminate on the basis of race, religion, color, national origin, gender, sexual orientation, age, marital status, veteran status, or disability status.
If you require alternative methods of application or screening, you must approach the employer directly to request this as Indeed is not responsible for the employer's application process.",HCA Healthcare
Business Intelligence Intern,https://www.indeed.com/rc/clk?jk=242efc87aa8408ef&fccid=16c2f46936642254&vjs=3,"Job details
No matching job preferences
Job Type
Internship
Company Overview: Hamilton Company is a worldwide leader in the design and manufacture of manual, semi-automated and robotic products for precision fluid measuring. We specialize in the development, manufacturing and customization of precision measurement devices, automated liquid handling stations, and sample management systems. For more than 60 years, Hamilton has been satisfying customer needs by combining quality materials with skilled workmanship, ensuring the highest level of performance of every precision fluid measuring device we manufacture. Responsibilities:
As a part of the Business Intelligence team, you will work with business stake holders to create data solutions that will drive cost reductions and efficiencies throughout the company's activities. As an Intern you will specifically work on organizing user requirements, testing/validating data pipelines, and building Bl reports using Power Bl. We need someone who is excited about data; can apply statistics and data analysis techniques to understand the data pipelines; and someone who wants to understand how business activities can be quantified and tracked to improve results.

Perform problem exploration, resolution, and documentation.
Create, modify, customize, and maintain Bl reports and templates.
Collaborate with cross-functional teams to define and test data requirements.
Build Reports for all functional areas including Sales, Manufacturing, and Procurement.
Qualifications:
Intermediate SQL.
Understanding of Relational Databases.
Understanding of Data Model Schemas.
Ability to work independently and as a member of a multifunctional team.
Desire to learn and take initiative.
Education/Experience:
Currently attending the University of Nevada, Reno.
Pursuing a degree (Undergrad or Graduate) in Computer Science, Information Systems, Statistics, Mathematics, Business, or another Quantitative field
Must have a High School diploma or equivalent.
Additional Information:
Diverse portfolio of exciting and innovative design projects
Tremendous opportunities for professional growth
Commitment to sustainable design
Competitive Compensation
Excellent Benefits Package includes medical, dental, vision insurance, paid vacation time, paid sick time, disability insurance, 401k, tuition reimbursement and much more
Solid Stable Company
Drug-free workplace
If you require alternative methods of application or screening, you must approach the employer directly to request this as Indeed is not responsible for the employer's application process.",Hamilton Company
