job_title,job_link,description,company_name
"Intern, Finance",https://www.indeed.com/rc/clk?jk=6a082747e561b4b9&fccid=fb509292145a023d&vjs=3,"Job details
No matching job preferences
Salary
$23 an hour
Job Type
Part-time
Internship
Shift and Schedule
Monday to Friday
Overview:
Now is the time to join us and make a difference. Be a relentless force for a world of longer, healthier lives. Here at the American Heart Association, you matter and so does your career.
The American Heart Association’s Internship Program provides college students an opportunity for hands-on experience in various facets for individuals interested in gaining work experience with a non-profit, voluntary health organization.
During your internship you will have the opportunity to perform a variety of duties related to financial accounting operations, annual audit preparation and support, and special projects. The Finance Intern will apply knowledge of Generally Accepted Accounting Principles (GAAP) to assist in daily, monthly, and year-end close activities, assist with internal and external audit support, and assist finance team members with various tasks to support special projects.
The Association offers many resources to help you maintain work-life harmonization through your changing needs and life situations. To help you be successful, you will have access to Heart U, our award-winning corporate university, as well as training and support locally and through our National Center.
#TheAHALife is our company culture, our way of life, reflecting our diversity and inclusion, our focus on work-life harmonization, and our Guiding Values. Discover why you will Be Seen. Be Heard. Be Valued™ at the American Heart Association by following us on LinkedIn, Instagram, Facebook, Twitter, and at heart.org.
Internship Overview:
Time Commitment: 25 hours per week
Internship Duration: 9/11/2023 – 12/8/2023
Hybrid position. Intern must be based in Dallas, TX, or the immediate surrounding area.
Salary: $23.00 per hour
Internship Outcomes:
Individuals participating in the internship program are provided with an opportunity to:
Gain important and practical job skills to be successful in a non-profit environment.
Opportunity to explore a career-path with a reputable voluntary health/service organization.
Gain experience in the professional world while learning about board management.
Complete an internship that enriches your academic and professional resume as well as enriches your personal life by making a difference in the lives of others.
Responsibilities:
Tasks could include things like the following:
Assist in support of National Center and Regions by performing a variety of duties related to general ledger accounting to support daily operations, month end, and year end closing of accounting records.
Assist in preparing monthly reconciliations for assigned entities’ balance sheet accounts and timely research/resolution of reconciling items.
Assist in preparing journal entries coinciding with established general ledger close deadlines including inter-company and association-wide journal entries.
Assist in internal/external audits including preparation of work papers, analysis, and documentation of processes and procedures as needed.
Interact and engage with different stakeholders during the monthly financial close processes and various tasks.
Gain experience in key finance processes of a non-profit organization, with an international presence.


Qualifications:
Working toward a bachelor’s or master’s degree in accounting, Finance, Data Science, Business/Administration, Information Systems, or a related field with an interest in finance.
Basic knowledge of Generally Accepted Accounting Principles (GAAP)
Demonstrated skills in effective one-on-one and group communications.
Ability to deal professionally in a corporate or non-profit environment and assume responsibility for guiding projects and programs from inception through completion.
Ability to work in a fast-paced, dynamic environment managing multiple priorities involving multiple entities.
Intermediate to excellent proficiency in MS Word, Excel, Outlook and PowerPoint.
Minimum availability of 20 hrs./wk., M-F between the hours of 8:30am-5pm.
Must be legally authorized to work in the United States for any employer without sponsorship, now or in the future. For any roles working remotely, the work must also be performed inside the United States, not in a foreign country.
Required Equipment:
Reliable WiFi Connection

Compensation & Benefits:
The American Heart Association invests in its people. Visit Rewards & Benefits to see more details.

Compensation and Performance – Attracting talented, committed interns means offering competitive compensation, ongoing professional development and training, and a diverse and inclusive environment in which to work and grow. And we do.
Professional Development – You can join one of our many Employee Resource Groups (ERG) or be a mentor/mentee in our professional mentoring program. HeartU is the Association’s national online university, with more than 100,000 resources designed to meet your needs and busy schedule.

:
Apply Today:

So, are you ready to intern for the largest voluntary health organization dedicated to fighting heart disease, stroke, and other cardiovascular diseases?

A cover letter is recommended to explain why an internship in public health at the American Heart Association appeals to you.

The American Heart Association’s 2024 Goal: Every person deserves the opportunity for a full, healthy life. As champions for health equity, by 2024, the American Heart Association will advance cardiovascular health for all, including identifying and removing barriers to health care access and quality.

At American Heart Association | American Stroke Association, diversity, inclusion, and equal opportunity applies to both our workforce and the communities we serve as it relates to heart health and stroke prevention.

This position not a match with your skills? Click here to see other opportunities.

EOE/Protected Veterans/Persons with Disabilities

: #AHAWAYUP",American Heart Association
"Intern, Project Management",https://www.indeed.com/rc/clk?jk=9e9f6421574e530a&fccid=fb509292145a023d&vjs=3,"Job details
No matching job preferences
Salary
$23 an hour
Job Type
Part-time
Internship
Shift and Schedule
Monday to Friday
Overview:
Now is the time to join us and make a difference. Be a relentless force for a world of longer, healthier lives. Here at the American Heart Association, you matter and so does your career.
The Data Science & Evaluation team is looking for a part-time intern interested in gaining project management experience and learning about how to evaluate the impact of AHA’s programs and initiatives.
The American Heart Association’s Internship Program provides college students an opportunity for hands-on experience in various facets for individuals interested in gaining work experience with a non-profit, voluntary health organization.
Individuals will obtain practical experience and receive hands-on training in project management and learn about public health program evaluation. In this position, you will work closely with the Director of Program Evaluation to support the overall effectiveness of the Program Evaluation Team.
The Association offers many resources to help you maintain work-life harmonization through your changing needs and life situations. To help you be successful, you will have access to Heart U, our award-winning corporate university, as well as training and support locally and through our National Center.
#TheAHALife is our company culture, our way of life, reflecting our diversity and inclusion, our focus on work-life harmonization and our Guiding Values. Discover why you will Be Seen. Be Heard. Be Valued™ at the American Heart Association by following us on LinkedIn, Instagram, Facebook, Twitter, and at heart.org.
Internship Overview:
Time Commitment: 20 hours per week
Internship Duration: 9/11/23 – 12/8/23
Location: Remote position
Salary: $23.00 per hour
Internship Outcomes:
Individuals participating in the internship program are provided with an opportunity to:
Gain important and practical job skills to be successful in a non-profit environment.
Opportunity to explore a career-path with a reputable voluntary health/service organization.
Gain experience in the professional world while learning about program evaluation.
Complete an internship that enriches your academic and professional resume as well as enriches your personal life by making a difference in the lives of others.
Responsibilities:
Tasks could include things like the following:
Create and/or maintain project plans and scope of work timelines.
Support team members with the creation of reports, presentations, or other client facing materials.
Develop and/or maintain internal tracking systems and procedures for 13 evaluation team members working on over 25 projects.

Qualifications:
Currently pursuing a master’s degree in Nonprofit Management, Public Administration, Project Management, or a related field of study.
Effective oral, written, and presentation communication skills.
Excellent organizational skills, project management skills, and attention to detail.
Strong problem-solving skills, with the ability to generate innovative solutions collaboratively and independently.
Excellent proficiency in MS Word, Excel, Outlook, and PowerPoint.
Knowledge of MS Planner is a plus.
Minimum availability of 20 hrs/wk, M-F between the hours of 8:30 am-5 pm.
Must be legally authorized to work in the United States for any employer without sponsorship, now or in the future. For any roles working remotely, the work must also be performed inside the United States, not in a foreign country.
Required Equipment:
Reliable WiFi Connection

Compensation & Benefits:
The American Heart Association invests in its people. Visit Rewards & Benefits to see more details.

Compensation and Performance – Attracting talented, committed interns means offering competitive compensation, ongoing professional development and training, and a diverse and inclusive environment in which to work and grow. And we do.
Professional Development – You can join one of our many Employee Resource Groups (ERG) or be a mentor/mentee in our professional mentoring program. HeartU is the Association’s national online university, with more than 100,000 resources designed to meet your needs and busy schedule.

:
Apply Today:

So, are you ready to intern for the largest voluntary health organization dedicated to fighting heart disease, stroke, and other cardiovascular diseases?

A cover letter is recommended to explain why an internship in public health at the American Heart Association appeals to you.

The American Heart Association’s 2024 Goal: Every person deserves the opportunity for a full, healthy life. As champions for health equity, by 2024, the American Heart Association will advance cardiovascular health for all, including identifying and removing barriers to health care access and quality.

At American Heart Association | American Stroke Association, diversity, inclusion, and equal opportunity applies to both our workforce and the communities we serve as it relates to heart health and stroke prevention.

This position not a match with your skills? Click here to see other opportunities.

EOE/Protected Veterans/Persons with Disabilities

: #AHAWAYUP",American Heart Association
Student Opportunities - Business Internship - Fall 2023 (Hybrid),https://www.indeed.com/rc/clk?jk=afbd81da16787fe8&fccid=ea99366887d9676b&vjs=3,"Job details
No matching job preferences
Salary
$18 an hour
Job Type
Internship
Student Opportunities - Business Internship - Fall 2023 (Hybrid) - (2300569)
US-OH-Fairfield
Description

Start your journey with us!
The Cincinnati Insurance Companies are currently looking for students who seek to gain a meaningful work experience with us as a business intern for the Fall of 2023. Interns perform duties in their respective departments as we provide you with a challenging experience.
Learn more about our company by:
participating in an introductory insurance class
hearing from different departments to understand our corporate structure
interacting with leadership and experienced associates
participating in group and individual projects
Common job duties (may vary by role or department):
Assist with business activities and processes
Participate and contribute in team meetings, presentations, and projects
Research emerging trends, data analysis, and evaluate options
Generate reports, promotional materials, and other work products
Serve internal and external customers
Some of the departments/areas that roles may be available include:
Accounting
Finance
Marketing
Audit
Corporate Communications
Fleet/Purchasing
Inventory
Make a difference with a career in insurance!
At The Cincinnati Insurance Companies, we put people first and apply the Golden Rule to our daily operations. To put this into action, we’re looking for extraordinary people to join our talented team. Our service-oriented, ethical, knowledgeable, caring associates are the heart of our vision to be the best company serving independent agents. We help protect families and businesses as they work to prevent or recover from a loss. Share your talents to help us reach for continued success as we bring value to the communities we serve and demonstrate that Actions Speak Louder in Person®.

If you’re ready to build productive relationships, collaborate within a diverse team, embrace challenges and develop your skills, then Cincinnati may be the place for you. We offer career opportunities where you can contribute and grow.
Requirements:
enrolled as a full-time, undergraduate student at an accredited college/university
all majors are welcome to apply
collegiate transcripts required with submission of candidate profile (unofficial are acceptable)
in good academic standing (cumulative GPA: 3.0 or higher preferred)
must be able to work at least 20 hours per week; Hybrid eligible, may vary by role
proficient in Microsoft® Office tools and related software
Starting Range of Pay, Depending on Knowledge and Skills: $18.00 per hour
Candidates should have the ability to work in the United States for an unlimited amount of time. Our company is currently not hiring interns for this role(s) if they will need sponsorship in the future.
Enhance your talents
Providing outstanding service and developing strong relationships with our independent agents are hallmarks of our company. Whether you have experience from another carrier or you’re new to the insurance industry, we promote a lifelong learning approach. Cincinnati provides you with the tools and training to be successful and to become a trusted, respected insurance professional – all while enjoying a meaningful career.
Embrace a diverse team
As a relationship-based organization, we welcome and value a diverse workforce. We provide equal employment opportunity to all qualified persons without regard to race; creed; color; sex, including sexual orientation, gender identity and transgender status; religion; national origin; age; disability; military service; veteran status; pregnancy; AIDS/HIV or genetic information; or any other basis prohibited by law. Learn more about the Federal Employment Notices.",The Cincinnati Insurance Companies
Strategic Research Intern (Fall 2023),https://www.indeed.com/rc/clk?jk=57351b8c1822b8f7&fccid=794ba0cd5980bd30&vjs=3,"Job details
No matching job preferences
Job Type
Internship
You: An inquisitive, creative, and self-motivated college junior or senior, graduate student, or recent graduate who knows the principles of liberty and seeks to advance them. You have strong written and oral communication skills and strong data skills and enjoy problem-solving. Your degree is in social science or another discipline with strong emphasis in data analysis training.
Them: Bureaucrats, city councils, mayors, governors, and federal agencies stripping Americans of their rights every day. There’s a lot of government overreach out there, and it’s backed by seemingly endless resources. But fortunately, like all lumbering giants, abusive government is most vulnerable when countered by individuals who act strategically and nimbly, take calculated risks, have each other’s backs, and are confident in and passionate for the cause—the very sort of swashbucklers we employ in spades here at PLF.
Us: We fight back. Pacific Legal Foundation is the nation’s first and most successful public interest law firm dedicated to vindicating individual liberty. PLF has an unmatched record in the United States Supreme Court, with 17 victories out of 19 cases litigated at the Court. We also have more than a hundred active cases across the nation.
We are a next-generation public interest law firm. What does “next-generation” mean for a legal nonprofit? It means we aren’t interested in doing the same thing as everyone else. We aspire to be the best player in a constantly changing game.
Here’s what you get to do in this role:
The Strategic Research Intern will work closely with the Strategic Research and Legal Policy Department. Our research team produces high-quality social science research to support PLF’s mission-driven goals. We coordinate with our litigation, legal policy, and communications teams. This is a paid internship.
This internship provides an opportunity for a wide variety of experiences, including:
Communicating with public officials to obtain public records.
Collecting, organizing, and analyzing data using Microsoft Excel or STATA.
Conducting literature reviews on such topics as regulatory reform, housing supply, property rights, and coastal land rights.
Developing internal data and literature memos for litigation, communications, or legal policy campaigns.
Writing blogs or op-eds on topics relevant to PLF’s work.
GENERAL INFORMATION
Pacific Legal Foundation identifies and litigates important legal issues to set landmark precedents that benefit Americans nationwide. Using strategic and principled litigation, communications, and research, we battle for freedom in the nation’s courts and the court of public opinion.
As a national nonprofit organization, PLF has brick-and-mortar offices in Sacramento, California; Arlington, Virginia; and Palm Beach Gardens, Florida, although approximately half of the staff work from home offices across the country. You can work physically in any of our offices or request to work virtually.
TO APPLY:
If you think you might be a good fit, submit the following application materials.
Your resume, including your experience in the liberty movement and relevant professional experience.
A cover letter explaining why PLF is the place for you, why you want to fight for liberty, and what distinguishes you from typical applicants.
Writing Sample
This position awards an educational stipend in two installments throughout the duration of the internship.",Pacific Legal Foundation
TikTok Creative Specialist Intern (TikTok Monetization Product) - 2023 Summer-Fall (BS/MS),https://www.indeed.com/rc/clk?jk=432e101769133bc2&fccid=caed318a9335aac0&vjs=3,"Job details
No matching job preferences
Salary
$23.75 an hour
Job Type
Internship
Responsibilities
TikTok is the leading destination for short-form mobile video. Our mission is to inspire creativity and bring joy. TikTok has global offices including Los Angeles, New York, London, Paris, Berlin, Dubai, Singapore, Jakarta, Seoul and Tokyo.

Why Join Us
At TikTok, our people are humble, intelligent, compassionate and creative. We create to inspire - for you, for us, and for more than 1 billion users on our platform. We lead with curiosity and aim for the highest, never shying away from taking calculated risks and embracing ambiguity as it comes. Here, the opportunities are limitless for those who dare to pursue bold ideas that exist just beyond the boundary of possibility. Join us and make impact happen with a career at TikTok.

The TikTok Creative Expert Center offers advertisers worldwide in-depth, concrete, and executable creative insights by industry. Our mission is to inspire external advertisers/service providers to Create for TikTok. Our goal is to help advertisers and creators master creative methodologies and form their own creative insights, production, and evaluation methods.

We are looking for talented individuals to join us for an internship in 2023. Internships at TikTok aim to offer students industry exposure and hands-on experience. Turn your ambitions into reality as your inspiration brings infinite opportunities at TikTok.

Job description:
Assist the TikTok creative expert team to discover in-depth creative recommendations through a large number of creative analyses, industry insights, industry trends, etc., and empower various downstream products, sales teams and advertisers.
Assist and support industry analysis, market research, competitive product research, creative material analysis, etc., and produce insight reports, creative briefings, and product manuals.
Assist the project manager, cooperate with relevant cooperation teams such as product technical sales data, follow up and promote the progress of the project.
Assist in other daily work within the department.
Qualifications
Currently pursuing a Bachelor or Masters degree in political science, English, Liberal arts, or related discipline.
We will prioritize those who can commit to working full time for a minimum of 12 weeks starting immediately, but are open to those who can do part time for a minimum of 20 hours per week.
Familiar with using Excel, SQL and other common office software, highly sensitive to data, meticulous work, good logical thinking and data analysis ability.
Proactive, strong executive ability, strong sense of responsibility, good organizational and communication skills and teamwork spirit, experience in organizing large-scale activities in clubs or schools is preferred.
Familiar with or interested in advertising.
Must obtain work authorization in the country of employment at the time of hire, and maintain ongoing work authorization during employment.
TikTok is committed to creating an inclusive space where employees are valued for their skills, experiences, and unique perspectives. Our platform connects people from across the globe and so does our workplace. At TikTok, our mission is to inspire creativity and bring joy. To achieve that goal, we are committed to celebrating our diverse voices and to creating an environment that reflects the many communities we reach. We are passionate about this and hope you are too.

TikTok is committed to providing reasonable accommodations in our recruitment processes for candidates with disabilities, pregnancy, sincerely held religious beliefs or other reasons protected by applicable laws. If you need assistance or a reasonable accommodation, please reach out to us at ec.accommodations@tiktok.com

By submitting an application for this role, you accept and agree to our global applicant privacy policy, which may be accessed here: https://careers.tiktok.com/legal/privacy.
Job Information
The hourly rate range for this position in the selected city is $23.75- $23.75.



Compensation may vary outside of this range depending on a number of factors, including a candidate’s qualifications, skills, competencies and experience, and location. Base pay is one part of the Total Package that is provided to compensate and recognize employees for their work, and this role may be eligible for additional discretionary bonuses/incentives, and restricted stock units.



At ByteDance/TikTok our benefits are designed to convey company culture and values, to create an efficient and inspiring work environment, and to support ByteDancers to give their best in both work and life. We offer the following benefits to eligible employees:



We cover 100% premium coverage for employee medical insurance, approximately 75% premium coverage for dependents and offer a Health Savings Account(HSA) with a company match. As well as Dental, Vision, Short/Long term Disability, Basic Life, Voluntary Life and AD&D insurance plans. In addition to Flexible Spending Account(FSA) Options like Health Care, Limited Purpose and Dependent Care.



Our time off and leave plans are: 10 paid holidays per year plus 17 days of Paid Personal Time Off(PPTO) (prorated upon hire and increased by tenure) and 10 paid sick days per year as well as 12 weeks of paid Parental leave and 8 weeks of paid Supplemental Disability.



We also provide generous benefits like mental and emotional health benefits through our EAP and Lyra. A 401K company match, gym and cellphone service reimbursements. The Company reserves the right to modify or change these benefits programs at any time, with or without notice.",TikTok
